{"directions":[{"challenged_assumption":"Failure should be interpreted through a particular added state or named mechanism rather than through transformation laws directly testable in the observations.","competing_explanations":["The residual response is equivariant under the same translations, reflections, and rotations as the resolved dynamics.","The residual contains a reproducible symmetry-selective component associated with orientation or position.","Apparent symmetry breaking is introduced by boundaries or discretization."],"decisive_experiment":{"intervention":"Create symmetry-related copies of each localized perturbation at boundary-matched positions, run them from correspondingly transformed initial conditions, and repeat after halving the grid spacing.","measurements":["Equivariance error between each response and the transformed reference response","Orientation- and position-conditioned residual modes","Change in those quantities under grid refinement and increased boundary separation"],"opposing_predictions":[{"explanation":"Shared symmetry law","prediction":"Transformed residual fields coincide within the deterministic numerical floor, and held-out responses are predicted by transforming a reference response."},{"explanation":"Symmetry-selective dynamics","prediction":"One or more residual components remain tied to absolute orientation or position, reproduce across initial conditions, and predict the favored response in held-out perturbations."},{"explanation":"Numerical or boundary artifact","prediction":"The apparent violation decreases at the discretization convergence rate or with greater boundary separation."}]},"direction_id":"direction-1","evidence_dependency":["fixed-template-recovery showed that representation-aligned recovery can manufacture apparent conceptual success.","closure-and-skill-route showed that predictive closure detects failure without identifying its organizing cause."],"local_feasibility":"A small deterministic two-dimensional simulator needs only a few transformed runs per perturbation; field transformations and norm comparisons are CPU-cheap.","negative_result_value":"An equivariant result would eliminate symmetry selection and establish that subsequent hypotheses should respect the measured transformation law.","novelty_risk":"Moderate: symmetry tests are established; value would require a residual symmetry signature that predicts interventions rather than merely redescribing the equations.","research_question":"Do failed predictions reveal a reproducible symmetry-selective response that is absent from the resolved dynamics?","stop_criterion":"Kill the symmetry-selective direction if violations never exceed five times the refinement-estimated numerical floor on held-out initial conditions, or if every violation vanishes at the numerical convergence rate or with boundary separation.","why_nontrivial":"The experiment tests an observable law across interventions and coordinate copies; it neither searches for a planted equation nor treats improved fitting as mechanistic evidence."},{"challenged_assumption":"All scientifically relevant influence in the failed model can be represented by a finite-range local closure.","competing_explanations":["Perturbation influence has a finite propagation cone and rapidly decaying spatial kernel.","The response contains a reproducible long-range component whose scale grows with the domain.","Long-range effects are boundary reflections or global normalization artifacts."],"decisive_experiment":{"intervention":"Apply equal-integral compact perturbations of several widths at multiple boundary-matched locations, then repeat on two domain sizes while preserving local resolution and dimensionless conditions.","measurements":["First-arrival time versus source-target distance","Response amplitude versus distance before any boundary return","Collapse of distance-response curves in local coordinates versus domain-normalized coordinates","Dependence on perturbation width at fixed integral"],"opposing_predictions":[{"explanation":"Finite-range local influence","prediction":"Arrival times define a stable finite-speed cone, and pre-arrival distant responses remain at the numerical floor on both domain sizes."},{"explanation":"Intrinsic long-range influence","prediction":"Responses occur outside every cone supported by near-field arrivals and follow a distance law that reproduces on held-out source locations and domain sizes."},{"explanation":"Boundary or normalization artifact","prediction":"The distant component shifts with boundary-return time or collapses only after normalization by total domain size."}]},"direction_id":"direction-2","evidence_dependency":["llm-memory-hypothesis underperformed state-free alternatives, motivating a direct response-law question without presuming extra state.","closure-and-skill-route established unexplained predictive structure but could not identify its cause."],"local_feasibility":"Impulse-response maps on modest grids can be accumulated deterministically in minutes, with two small domain sizes sufficient for the initial discrimination.","negative_result_value":"Absence of out-of-cone response would bound the admissible interaction range and focus later work on local explanations; domain dependence would identify an artifact control that future tests must include.","novelty_risk":"Moderate to high: locality diagnostics are familiar, so novelty would depend on discovering a stable, intervention-predictive distance law not implied by the baseline.","research_question":"Does the unexplained response obey a finite propagation law, or is there an intervention-reproducible influence outside every locally inferred propagation cone?","stop_criterion":"Kill the intrinsic long-range direction if all pre-arrival distant responses stay below five times the numerical floor across held-out locations, or if apparent distant responses track boundary-return time or domain-wide normalization.","why_nontrivial":"Domain scaling and arrival-time ordering distinguish physical spatial organization from a flexible residual fit and from boundary contamination."},{"challenged_assumption":"Failures produced by multiple perturbations can be understood as the sum of failures produced by each perturbation separately.","competing_explanations":["Residual responses compose additively after accounting for the resolved model.","Two perturbations generate an irreducible interaction with a characteristic separation or timing dependence.","The apparent interaction is ordinary instantaneous amplitude saturation rather than a distinct cooperative response."],"decisive_experiment":{"intervention":"Use a preregistered factorial design containing perturbation A alone, B alone, A and B together, and amplitude-matched single controls; sweep A-B distance, pulse order, and pulse lag, then reserve several combinations as held-out tests.","measurements":["Interaction contrast R(A+B)-R(A)-R(B)+R(0) in prediction space","Interaction magnitude versus distance and pulse lag","Order asymmetry between A-then-B and B-then-A","Performance on held-out factorial combinations without refitting"],"opposing_predictions":[{"explanation":"Additive response","prediction":"The interaction contrast remains at the deterministic floor for every distance, lag, and held-out combination."},{"explanation":"Irreducible cooperative response","prediction":"A nonzero contrast has a reproducible distance-lag profile and correctly predicts held-out joint responses from the preregistered factorial law."},{"explanation":"Instantaneous saturation","prediction":"The contrast is reproduced by amplitude-matched single controls, depends on simultaneous total amplitude, and has no additional pulse-order signature."}]},"direction_id":"direction-3","evidence_dependency":["llm-memory-hypothesis showed that an appealing named mechanism can lose to state-free alternatives under intervention.","null-world-control showed that fitting can set an unnecessary effect to zero, suggesting that a decisive proposal should include an exact null contrast.","fixed-template-recovery showed why success must be defined by held-out response structure rather than recovery of planted form."],"local_feasibility":"The factorial contrasts require only a small grid of deterministic simulations and simple array arithmetic, readily completing within 30 minutes on one CPU.","negative_result_value":"A null contrast would establish an additive regime and provide a stringent certificate against cooperative stories; saturation-only behavior would redirect attention to the resolved instantaneous response.","novelty_risk":"Moderate: factorial interaction tests are standard, and scientific novelty would require a stable distance-lag law with new predictive consequences.","research_question":"Do failed predictions contain an irreducible cooperative response to paired perturbations, with a measurable spatial or temporal interaction scale?","stop_criterion":"Kill the cooperative-response direction if interaction contrasts remain below five times the numerical floor on all held-out combinations, or if amplitude-matched instantaneous saturation predicts them within that tolerance.","why_nontrivial":"The factorial null is algebraically sharp, while distance, lag, order, and amplitude controls separate cooperation from additivity and generic nonlinearity."},{"challenged_assumption":"The observed failure is a roughly uniform misspecification rather than evidence concentrated near a qualitative transition.","competing_explanations":["Residual error changes smoothly with intervention amplitude and reflects distributed misspecification.","A transition boundary organizes the failure, producing branch changes and divergent recovery or susceptibility.","A sharp boundary is a timestep, grid, or finite-duration artifact."],"decisive_experiment":{"intervention":"Sweep a scalar perturbation amplitude adaptively through the region where held-out error ris